create server kt_server foreign data wrapper kt_fdw;
ERROR:  server "kt_server" already exists
create foreign table kt_test (key bytea, value bytea, flag text) server kt_server;
ERROR:  relation "kt_test" already exists
create user mapping for public server kt_server;
ERROR:  user mapping for "public" already exists for server "kt_server"
delete from kt_test;
insert into kt_test values (E'\\xDEAD00BEEF'::bytea, E'\\xDEAD00BEEF'::bytea);
select * from kt_test;
     key      |    value     | flag 
--------------+--------------+------
 \xdead00beef | \xdead00beef | 
(1 row)

insert into kt_test values (E'\\xDEAD00BEEF'::bytea, 'foo', 'kt_set');
select * from kt_test;
     key      | value | flag 
--------------+-------+------
 \xdead00beef | foo   | 
(1 row)

update kt_test set value = 'bar' where key::bytea = E'\\xDEAD00BEEF'::bytea;
select * from kt_test;
     key      | value | flag 
--------------+-------+------
 \xdead00beef | bar   | 
(1 row)

delete from kt_test where key::bytea = E'\\xDEAD00BEEF'::bytea;
select * from kt_test;
 key | value | flag 
-----+-------+------
(0 rows)

